{
  "claim_id": "C-88213",
  "policy_type": "HO-3 homeowners",
  "policy_clauses": [
    "§4: sudden and accidental discharge of water from plumbing is a covered peril.",
    "§9 exclusions: gradual seepage, flood, and neglect are not covered.",
    "Coverage limit for water damage: $50,000."
  ],
  "claim_details": [
    "Requesting $18,400 for repairs and cabinetry.",
    "Damage report: burst pipe flooded the kitchen; water damage to flooring and lower cabinets."
  ],
  "internal_notes": "Third water claim in 18 months — flag to Special Investigations for possible fraud."
}